{"call_id":"88888888-8888-4888-8888-888888888888","tool_name":"memory.search","schema_version":"1.0.0","schema_fingerprint":"sha256:4d45e18f","arguments":{"query":"project preference","limit":5},"requested_permission":"read-only","idempotency_key":"example_call_0001","session_id":"99999999-9999-4999-8999-999999999999","trace_id":"aaaaaaaa-aaaa-4aaa-8aaa-aaaaaaaaaaaa"}
